id;name;description;price;info;misc;url;lat;lng
1;Rooster;Cafe, bar and restaurant;$$;Torikatu 26;Good burgers, has a downstair pub floor.;https://rooster.fi/;65.01152;25.4667066
2;Oluthuone Leskinen;Pub;$$;Kirkkokatu 10;The original after work place of the City. More mature oriented, but culturally significant. Has a large collection of seasonal beers.;https://www.leskinen.fi/;65.0120581;25.4703566
3;Snooker Time;Pub & Bar;$;Asemakatu 28;A good place if you're looking for a place to talk to strangers.;http://snookertime.net/;65.0139113;25.4746054
4;Kuluma;Pub & Cafe;$$;Kauppurienkatu 5;An all-around place. Has everything for everyone. (Tip: next to Kauppuri 5);https://kuluma.fi/;65.0128863;25.4668808
5;Heinäpään Oluttupa;Pub;$$;Isokatu 77;A local pub of the unique Heinäpää region, filled with Heinäpää regulars.;https://www.instagram.com/oluttupa90120/?hl=en;65.0057474;25.4643623
6;St. Michael;Pub;$$;Hallituskatu 13;Self explanatory, really...;http://www.stmichael.fi/;65.0127425;25.4754993
7;Letkunpuiston Helmi;Pub;$;Uusikatu 23;A good choice for some after work chilling.;https://www.tulikuuma.fi/restaurant/pub-club-letkunpuiston-helmi/;65.0118483;25.476486
8;Peppers;Pub & Karaoke;$$;Isokatu 36;Never go here. I don't know many people who've entered this place and returned unchanged.;https://www.karaokebar.net/peppers;65.0157691;25.4787288
